{
  "bundle_id": "sample_bundle_v1",
  "skills_sources": ["./skills/demo_writer"],
  "skill_lists": [
    {
      "list_id": "sample_default_skills",
      "display_name": "Sample Default Skills",
      "include_all": false,
      "skill_ids": ["demo-writer"]
    }
  ],
  "agents": [
    {
      "agent_id": "sample_mgr",
      "display_name": "Sample Manager",
      "prompt": "Role Function: define workflow plan and ownership. Usable Tools: planning docs, checklists, and API metadata. Method: milestone-based decomposition with explicit assumptions.",
      "skill_list": ["sample_default_skills"],
      "provider_id": "minimax",
      "default_model_params": {
        "model": "MiniMax-Text-01",
        "effort": "medium"
      },
      "model_selection_enabled": true
    },
    {
      "agent_id": "sample_dev",
      "display_name": "Sample Developer",
      "prompt": "Role Function: execute implementation tasks and produce outputs. Usable Tools: source workspace, scripts, and verification utilities. Method: incremental delivery with traceable evidence.",
      "skill_list": ["sample_default_skills"],
      "provider_id": "minimax",
      "default_model_params": {
        "model": "MiniMax-Text-01",
        "effort": "medium"
      },
      "model_selection_enabled": true
    },
    {
      "agent_id": "sample_qa_guard",
      "display_name": "Sample QA Guard",
      "prompt": "Role Function: own verification and acceptance decisions. Usable Tools: acceptance checklist, test reports, and artifact reviews. Method: criteria-first validation and explicit pass/block conclusions.",
      "skill_list": ["sample_default_skills"],
      "provider_id": "minimax",
      "default_model_params": {
        "model": "MiniMax-Text-01",
        "effort": "medium"
      },
      "model_selection_enabled": true
    }
  ],
  "project": {
    "project_id": "sample_project_v1",
    "name": "Sample Agent Workspace Project",
    "workspace_path": "D:\\AgentWorkSpace\\AgentWorkspace\\SampleProject",
    "agent_ids": ["sample_mgr", "sample_dev", "sample_qa_guard"],
    "route_table": {
      "sample_mgr": ["sample_dev", "sample_qa_guard"],
      "sample_dev": ["sample_mgr", "sample_qa_guard"],
      "sample_qa_guard": ["sample_mgr", "sample_dev"]
    },
    "task_assign_route_table": {
      "sample_mgr": ["sample_dev", "sample_qa_guard"],
      "sample_qa_guard": ["sample_dev"]
    }
  },
  "workflow_template": {
    "template_id": "sample_workflow_template_v1",
    "name": "Sample Workflow Template",
    "description": "Template generated by external agent-workspace sample bundle.",
    "tasks": [
      {
        "task_id": "sample_task_plan",
        "title": "Plan phase",
        "owner_role": "sample_mgr",
        "acceptance": [
          "objective: define scope and quality targets",
          "input: requirements and constraints are documented",
          "output: planning summary and checklist are produced",
          "constraints: implementation is not performed in planning phase",
          "exception: missing inputs are captured as assumptions",
          "verification: each scope item has owner and success criteria"
        ],
        "artifacts": ["workspace/plan/summary.md", "workspace/plan/checklist.md"],
        "write_set": ["workspace/plan/**"]
      },
      {
        "task_id": "sample_task_execute",
        "title": "Execution phase",
        "owner_role": "sample_dev",
        "parent_task_id": "sample_task_plan",
        "dependencies": ["sample_task_plan"],
        "acceptance": [
          "objective: produce execution deliverables",
          "input: approved planning summary is consumed",
          "output: implementation result and trace evidence are produced",
          "constraints: remain within agreed scope",
          "exception: blockers include fallback action and impact",
          "verification: outputs map to acceptance criteria"
        ],
        "artifacts": ["workspace/exec/result.md", "workspace/exec/evidence.md"],
        "write_set": ["workspace/exec/**"]
      },
      {
        "task_id": "sample_task_acceptance",
        "title": "Acceptance phase",
        "owner_role": "sample_qa_guard",
        "dependencies": ["sample_task_execute"],
        "acceptance": [
          "objective: issue final acceptance decision",
          "input: execution artifacts and evidence are reviewed",
          "output: pass or block report is documented",
          "constraints: QA review is independent from execution role",
          "exception: failed checks include fix recommendation",
          "verification: each criterion has status and rationale"
        ],
        "artifacts": ["workspace/qa/final.md", "workspace/qa/checklist.md"],
        "write_set": ["workspace/qa/**"]
      }
    ],
    "route_table": {
      "sample_mgr": ["sample_dev"],
      "sample_dev": ["sample_mgr"]
    }
  },
  "workflow_run": {
    "run_id": "sample_workflow_run_v1",
    "template_id": "sample_workflow_template_v1",
    "name": "Sample Workflow Run",
    "workspace_path": "D:\\AgentWorkSpace\\AgentWorkspace\\SampleProject",
    "auto_dispatch_enabled": false,
    "auto_dispatch_remaining": 0,
    "auto_start": false
  }
}
